number,value,datetime_start,datetime_complete,duration,params_factor,params_gamma,params_optimizer,params_scheduler,params_step_size,state
0,0.011071967606673255,2025-07-23 14:18:48.036208,2025-07-23 16:23:41.776438,0 days 02:04:53.740230,,,Adam,CosineAnnealingLR,,COMPLETE
1,0.01561336545500975,2025-07-23 16:23:41.827946,2025-07-23 18:33:00.064137,0 days 02:09:18.236191,,,RMSprop,CosineAnnealingLR,,COMPLETE
2,0.00993169256008659,2025-07-23 18:33:00.156630,2025-07-23 20:36:03.555824,0 days 02:03:03.399194,0.4323836890581305,,Adam,ReduceLROnPlateau,,COMPLETE
3,0.049050217418457845,2025-07-23 20:36:03.601037,2025-07-24 09:32:26.851808,0 days 12:56:23.250771,,0.5775557083512377,SGD,StepLR,22.0,COMPLETE
4,0.04724912638177026,2025-07-24 09:32:26.894398,2025-07-24 21:26:15.855362,0 days 11:53:48.960964,,0.6676441794867605,SGD,StepLR,20.0,COMPLETE
5,0.26027796877072057,2025-07-24 21:26:15.887080,2025-07-24 21:29:48.920787,0 days 00:03:33.033707,,0.4100206137462638,SGD,StepLR,22.0,PRUNED
6,0.044380628211734816,2025-07-24 21:29:48.967823,2025-07-24 21:33:22.453998,0 days 00:03:33.486175,,0.413902309359615,RMSprop,StepLR,14.0,PRUNED
7,0.21041562219687518,2025-07-24 21:33:22.474769,2025-07-24 21:36:53.728816,0 days 00:03:31.254047,,,SGD,CosineAnnealingLR,,PRUNED
8,0.03433914790140302,2025-07-24 21:36:53.745027,2025-07-24 21:40:22.517492,0 days 00:03:28.772465,0.4317069770490872,,Adam,ReduceLROnPlateau,,PRUNED
9,0.02266718895708066,2025-07-24 21:40:22.543254,2025-07-24 22:01:18.821440,0 days 00:20:56.278186,,0.42980691801232446,RMSprop,StepLR,16.0,PRUNED
10,0.010984531750775274,2025-07-24 22:01:18.847387,2025-07-25 00:54:09.663439,0 days 02:52:50.816052,0.6382050819824789,,Adam,ReduceLROnPlateau,,COMPLETE
11,0.024397607082782796,2025-07-25 00:54:09.702773,2025-07-25 01:09:57.687993,0 days 00:15:47.985220,0.6983351584879476,,Adam,ReduceLROnPlateau,,PRUNED
12,0.02462026433951257,2025-07-25 01:09:57.708230,2025-07-25 01:36:50.042814,0 days 00:26:52.334584,0.5872120111659851,,Adam,ReduceLROnPlateau,,PRUNED
13,0.0066889875530694335,2025-07-25 01:36:50.126479,2025-07-25 03:41:11.532411,0 days 02:04:21.405932,0.32874927535664394,,Adam,ReduceLROnPlateau,,COMPLETE
14,0.05305868631428574,2025-07-25 03:41:11.623058,2025-07-25 03:46:20.055695,0 days 00:05:08.432637,0.3025770292933855,,Adam,ReduceLROnPlateau,,PRUNED
15,0.018512378157433607,2025-07-25 03:46:20.124878,2025-07-25 04:29:39.867837,0 days 00:43:19.742959,0.37481635084978737,,Adam,ReduceLROnPlateau,,PRUNED
16,0.009958059692681855,2025-07-25 04:29:39.891044,2025-07-25 06:30:04.239448,0 days 02:00:24.348404,0.4822880588130838,,Adam,ReduceLROnPlateau,,COMPLETE
17,0.03817159297492033,2025-07-25 06:30:04.317429,2025-07-25 06:33:28.457446,0 days 00:03:24.140017,0.30429172814612176,,Adam,ReduceLROnPlateau,,PRUNED
18,0.022684813151532243,2025-07-25 06:33:28.474788,2025-07-25 06:52:02.283768,0 days 00:18:33.808980,0.4046381854760268,,Adam,ReduceLROnPlateau,,PRUNED
19,0.04096163551956838,2025-07-25 06:52:02.341749,2025-07-25 06:55:04.254031,0 days 00:03:01.912282,0.5172992717184285,,RMSprop,ReduceLROnPlateau,,PRUNED
20,0.03851441762088046,2025-07-25 06:55:04.276114,2025-07-25 06:58:06.249586,0 days 00:03:01.973472,,,Adam,CosineAnnealingLR,,PRUNED
21,0.018739771082331737,2025-07-25 06:58:06.274093,2025-07-25 07:32:41.547875,0 days 00:34:35.273782,0.48545683675259854,,Adam,ReduceLROnPlateau,,PRUNED
22,0.02734592468189542,2025-07-25 07:32:41.577608,2025-07-25 07:52:19.905702,0 days 00:19:38.328094,0.49609530454500916,,Adam,ReduceLROnPlateau,,PRUNED
23,0.051221277812574996,2025-07-25 07:52:19.969837,2025-07-25 07:56:51.821991,0 days 00:04:31.852154,0.3763935124664562,,Adam,ReduceLROnPlateau,,PRUNED
24,0.041235054177650735,2025-07-25 07:56:51.872410,2025-07-25 08:02:57.797789,0 days 00:06:05.925379,0.4566831799614805,,Adam,ReduceLROnPlateau,,PRUNED
25,0.03406329863782901,2025-07-25 08:02:57.949637,2025-07-25 08:43:25.212140,0 days 00:40:27.262503,0.5533097218124028,,Adam,ReduceLROnPlateau,,PRUNED
26,0.024266074653173184,2025-07-25 08:43:25.375321,2025-07-25 09:11:37.474921,0 days 00:28:12.099600,0.35443392328003254,,Adam,ReduceLROnPlateau,,PRUNED
27,0.012303495039122868,2025-07-25 09:11:37.496915,2025-07-25 11:04:47.450693,0 days 01:53:09.953778,0.4339018290972923,,Adam,ReduceLROnPlateau,,COMPLETE
28,0.22607700759127117,2025-07-25 11:04:47.637227,2025-07-25 11:10:59.711234,0 days 00:06:12.074007,0.3421478190695477,,SGD,ReduceLROnPlateau,,PRUNED
29,0.046915933026448205,2025-07-25 11:10:59.827172,2025-07-25 11:17:20.629012,0 days 00:06:20.801840,,,RMSprop,CosineAnnealingLR,,PRUNED
30,0.02070179414408042,2025-07-25 11:17:20.740947,2025-07-25 12:02:01.347316,0 days 00:44:40.606369,,,Adam,CosineAnnealingLR,,PRUNED
31,0.01493040672590843,2025-07-25 12:02:01.377966,2025-07-25 12:38:12.779701,0 days 00:36:11.401735,0.6392704768357621,,Adam,ReduceLROnPlateau,,PRUNED
32,0.03537985754716056,2025-07-25 12:38:12.858463,2025-07-25 12:41:26.637521,0 days 00:03:13.779058,0.551743347688513,,Adam,ReduceLROnPlateau,,PRUNED
33,0.02131030725197118,2025-07-25 12:41:26.653031,2025-07-25 13:00:37.763238,0 days 00:19:11.110207,0.6105213229729187,,Adam,ReduceLROnPlateau,,PRUNED
34,0.04120636903540917,2025-07-25 13:00:37.789848,2025-07-25 13:03:46.794057,0 days 00:03:09.004209,0.47132777660978536,,Adam,ReduceLROnPlateau,,PRUNED
35,0.20196203898349482,2025-07-25 13:03:46.826172,2025-07-25 13:06:53.241481,0 days 00:03:06.415309,,0.300895806348716,SGD,StepLR,30.0,PRUNED
36,0.038191835339205844,2025-07-25 13:06:53.257039,2025-07-25 13:10:01.857398,0 days 00:03:08.600359,0.5221892115483359,,RMSprop,ReduceLROnPlateau,,PRUNED
37,0.0209065366782989,2025-07-25 13:10:01.878775,2025-07-25 13:28:59.791895,0 days 00:18:57.913120,,0.696267629144574,Adam,StepLR,30.0,PRUNED
38,0.26588229031874844,2025-07-25 13:28:59.839726,2025-07-25 13:33:44.402275,0 days 00:04:44.562549,,,SGD,CosineAnnealingLR,,PRUNED
39,0.02554166223274922,2025-07-25 13:33:44.487374,2025-07-25 13:55:47.205141,0 days 00:22:02.717767,0.43445357479846397,,Adam,ReduceLROnPlateau,,PRUNED
40,0.016768482536124014,2025-07-25 13:55:47.275181,2025-07-25 14:35:36.872362,0 days 00:39:49.597181,,0.5677881533468062,RMSprop,StepLR,10.0,PRUNED
41,0.03815582533895419,2025-07-25 14:35:36.917607,2025-07-25 14:38:45.134398,0 days 00:03:08.216791,,,Adam,CosineAnnealingLR,,PRUNED
42,0.018869011333602772,2025-07-25 14:38:45.150374,2025-07-25 15:10:17.031859,0 days 00:31:31.881485,,,Adam,CosineAnnealingLR,,PRUNED
43,0.05385675403374732,2025-07-25 15:10:17.051553,2025-07-25 15:13:25.468554,0 days 00:03:08.417001,,,Adam,CosineAnnealingLR,,PRUNED
44,0.3354345057306808,2025-07-25 15:13:25.474624,2025-07-25 15:16:31.033986,0 days 00:03:05.559362,,,SGD,CosineAnnealingLR,,PRUNED
45,0.03344894837580768,2025-07-25 15:16:31.057708,2025-07-25 15:19:44.723214,0 days 00:03:13.665506,0.6799170613652787,,Adam,ReduceLROnPlateau,,PRUNED
46,0.01914394830018971,2025-07-25 15:19:44.754394,2025-07-25 15:57:57.278748,0 days 00:38:12.524354,,0.310139349214152,Adam,StepLR,26.0,PRUNED
47,0.015750074705916155,2025-07-25 15:57:57.362445,2025-07-25 16:53:25.002172,0 days 00:55:27.639727,0.4026118096024989,,Adam,ReduceLROnPlateau,,PRUNED
48,0.04381577193857187,2025-07-25 16:53:25.090519,2025-07-25 16:58:38.141175,0 days 00:05:13.050656,,,Adam,CosineAnnealingLR,,PRUNED
49,0.053940527412287886,2025-07-25 16:58:38.180429,2025-07-25 17:02:57.836547,0 days 00:04:19.656118,0.5500836356332859,,RMSprop,ReduceLROnPlateau,,PRUNED
